{
  "schemaVersion": 1,
  "contentVersion": "1.0.0",
  "seasonID": "season_2026_02",
  "titleKo": "푸른 궤도의 잔향",
  "startsAt": "2026-08-31T00:00:00Z",
  "endsAt": "2026-10-26T00:00:00Z",
  "selectionSeed": 3,
  "weeklyXPCap": 2500,
  "codexEntryID": "codex_season_blue_orbit",
  "dailyMissionPool": [
    {"id":"daily_dismantle","titleKo":"괴수 45체 해체","cadence":"daily","metric":"dismantle_enemy","target":45,"xp":80},
    {"id":"daily_parts","titleKo":"부품 140개 회수","cadence":"daily","metric":"salvage_part","target":140,"xp":80},
    {"id":"daily_manual","titleKo":"직접 해체 90회","cadence":"daily","metric":"manual_salvage","target":90,"xp":70},
    {"id":"daily_crew","titleKo":"직원 협동 공격 140회","cadence":"daily","metric":"crew_attack","target":140,"xp":70},
    {"id":"daily_stage","titleKo":"스테이지 6회 정리","cadence":"daily","metric":"clear_stage","target":6,"xp":100},
    {"id":"daily_expedition","titleKo":"원정 1회 귀환","cadence":"daily","metric":"expedition_complete","target":1,"xp":90}
  ],
  "weeklyMissions": [
    {"id":"weekly_boss","titleKo":"궤도 괴수 3체 격파","cadence":"weekly","metric":"defeat_boss","target":3,"xp":300},
    {"id":"weekly_stage","titleKo":"스테이지 40회 정리","cadence":"weekly","metric":"clear_stage","target":40,"xp":300},
    {"id":"weekly_parts","titleKo":"부품 1400개 회수","cadence":"weekly","metric":"salvage_part","target":1400,"xp":300},
    {"id":"weekly_expedition","titleKo":"원정 7회 귀환","cadence":"weekly","metric":"expedition_complete","target":7,"xp":300}
  ],
  "rewardTiers": [
    {"level":1,"xpRequired":500,"free":{"kind":"currency","itemID":"credits","amount":120},"premium":{"kind":"cosmetic","itemID":"blue_orbit_sticker_01","amount":1}},
    {"level":2,"xpRequired":1000,"free":{"kind":"material","itemID":"parts","amount":22},"premium":{"kind":"cosmetic","itemID":"blue_orbit_nameplate_02","amount":1}},
    {"level":3,"xpRequired":1500,"free":{"kind":"currency","itemID":"credits","amount":170},"premium":{"kind":"cosmetic","itemID":"blue_orbit_emote_03","amount":1}},
    {"level":4,"xpRequired":2000,"free":{"kind":"material","itemID":"circuit","amount":6},"premium":{"kind":"cosmetic","itemID":"blue_orbit_trail_04","amount":1}},
    {"level":5,"xpRequired":2500,"free":{"kind":"material","itemID":"parts","amount":32},"premium":{"kind":"convenience","itemID":"loadout_preset_slot_orbit_a","amount":1}},
    {"level":6,"xpRequired":3000,"free":{"kind":"currency","itemID":"credits","amount":220},"premium":{"kind":"cosmetic","itemID":"blue_orbit_sticker_06","amount":1}},
    {"level":7,"xpRequired":3500,"free":{"kind":"material","itemID":"parts","amount":37},"premium":{"kind":"cosmetic","itemID":"blue_orbit_nameplate_07","amount":1}},
    {"level":8,"xpRequired":4000,"free":{"kind":"material","itemID":"alloy","amount":4},"premium":{"kind":"cosmetic","itemID":"blue_orbit_emote_08","amount":1}},
    {"level":9,"xpRequired":4500,"free":{"kind":"currency","itemID":"credits","amount":270},"premium":{"kind":"cosmetic","itemID":"blue_orbit_trail_09","amount":1}},
    {"level":10,"xpRequired":5000,"free":{"kind":"story","itemID":"blue_orbit_record_01","amount":1},"premium":{"kind":"cosmetic","itemID":"mo_blue_orbit_visor","amount":1}},
    {"level":11,"xpRequired":5500,"free":{"kind":"material","itemID":"parts","amount":42},"premium":{"kind":"cosmetic","itemID":"blue_orbit_sticker_11","amount":1}},
    {"level":12,"xpRequired":6000,"free":{"kind":"currency","itemID":"credits","amount":320},"premium":{"kind":"cosmetic","itemID":"blue_orbit_nameplate_12","amount":1}},
    {"level":13,"xpRequired":6500,"free":{"kind":"material","itemID":"circuit","amount":9},"premium":{"kind":"cosmetic","itemID":"blue_orbit_emote_13","amount":1}},
    {"level":14,"xpRequired":7000,"free":{"kind":"material","itemID":"parts","amount":47},"premium":{"kind":"cosmetic","itemID":"blue_orbit_trail_14","amount":1}},
    {"level":15,"xpRequired":7500,"free":{"kind":"currency","itemID":"credits","amount":370},"premium":{"kind":"convenience","itemID":"loadout_preset_slot_orbit_b","amount":1}},
    {"level":16,"xpRequired":8000,"free":{"kind":"material","itemID":"alloy","amount":6},"premium":{"kind":"cosmetic","itemID":"blue_orbit_sticker_16","amount":1}},
    {"level":17,"xpRequired":8500,"free":{"kind":"material","itemID":"parts","amount":52},"premium":{"kind":"cosmetic","itemID":"blue_orbit_nameplate_17","amount":1}},
    {"level":18,"xpRequired":9000,"free":{"kind":"currency","itemID":"credits","amount":420},"premium":{"kind":"cosmetic","itemID":"blue_orbit_emote_18","amount":1}},
    {"level":19,"xpRequired":9500,"free":{"kind":"material","itemID":"circuit","amount":11},"premium":{"kind":"cosmetic","itemID":"blue_orbit_trail_19","amount":1}},
    {"level":20,"xpRequired":10000,"free":{"kind":"story","itemID":"blue_orbit_record_02","amount":1},"premium":{"kind":"cosmetic","itemID":"riv0_blue_orbit_shell","amount":1}},
    {"level":21,"xpRequired":10500,"free":{"kind":"currency","itemID":"credits","amount":470},"premium":{"kind":"cosmetic","itemID":"blue_orbit_sticker_21","amount":1}},
    {"level":22,"xpRequired":11000,"free":{"kind":"material","itemID":"parts","amount":57},"premium":{"kind":"cosmetic","itemID":"blue_orbit_nameplate_22","amount":1}},
    {"level":23,"xpRequired":11500,"free":{"kind":"material","itemID":"alloy","amount":8},"premium":{"kind":"cosmetic","itemID":"blue_orbit_emote_23","amount":1}},
    {"level":24,"xpRequired":12000,"free":{"kind":"currency","itemID":"credits","amount":520},"premium":{"kind":"cosmetic","itemID":"blue_orbit_trail_24","amount":1}},
    {"level":25,"xpRequired":12500,"free":{"kind":"material","itemID":"parts","amount":62},"premium":{"kind":"convenience","itemID":"appearance_preset_slot_orbit_a","amount":1}},
    {"level":26,"xpRequired":13000,"free":{"kind":"material","itemID":"circuit","amount":13},"premium":{"kind":"cosmetic","itemID":"blue_orbit_sticker_26","amount":1}},
    {"level":27,"xpRequired":13500,"free":{"kind":"currency","itemID":"credits","amount":570},"premium":{"kind":"cosmetic","itemID":"blue_orbit_nameplate_27","amount":1}},
    {"level":28,"xpRequired":14000,"free":{"kind":"material","itemID":"parts","amount":67},"premium":{"kind":"cosmetic","itemID":"blue_orbit_emote_28","amount":1}},
    {"level":29,"xpRequired":14500,"free":{"kind":"material","itemID":"alloy","amount":10},"premium":{"kind":"cosmetic","itemID":"blue_orbit_trail_29","amount":1}},
    {"level":30,"xpRequired":15000,"free":{"kind":"story","itemID":"blue_orbit_record_03","amount":1},"premium":{"kind":"cosmetic","itemID":"bora_blue_orbit_uniform","amount":1}},
    {"level":31,"xpRequired":15500,"free":{"kind":"currency","itemID":"credits","amount":620},"premium":{"kind":"cosmetic","itemID":"blue_orbit_sticker_31","amount":1}},
    {"level":32,"xpRequired":16000,"free":{"kind":"material","itemID":"parts","amount":72},"premium":{"kind":"cosmetic","itemID":"blue_orbit_nameplate_32","amount":1}},
    {"level":33,"xpRequired":16500,"free":{"kind":"material","itemID":"circuit","amount":16},"premium":{"kind":"cosmetic","itemID":"blue_orbit_emote_33","amount":1}},
    {"level":34,"xpRequired":17000,"free":{"kind":"currency","itemID":"credits","amount":670},"premium":{"kind":"cosmetic","itemID":"blue_orbit_trail_34","amount":1}},
    {"level":35,"xpRequired":17500,"free":{"kind":"material","itemID":"parts","amount":77},"premium":{"kind":"convenience","itemID":"appearance_preset_slot_orbit_b","amount":1}},
    {"level":36,"xpRequired":18000,"free":{"kind":"material","itemID":"alloy","amount":13},"premium":{"kind":"cosmetic","itemID":"blue_orbit_sticker_36","amount":1}},
    {"level":37,"xpRequired":18500,"free":{"kind":"currency","itemID":"credits","amount":720},"premium":{"kind":"cosmetic","itemID":"blue_orbit_nameplate_37","amount":1}},
    {"level":38,"xpRequired":19000,"free":{"kind":"material","itemID":"parts","amount":82},"premium":{"kind":"cosmetic","itemID":"blue_orbit_emote_38","amount":1}},
    {"level":39,"xpRequired":19500,"free":{"kind":"material","itemID":"stellar_core","amount":1},"premium":{"kind":"cosmetic","itemID":"blue_orbit_trail_39","amount":1}},
    {"level":40,"xpRequired":20000,"free":{"kind":"story","itemID":"blue_orbit_record_final","amount":1},"premium":{"kind":"cosmetic","itemID":"shelter_blue_orbit_skin","amount":1}}
  ]
}
