{
  "schemaVersion": 1,
  "contentVersion": "1.0.0",
  "seasonID": "season_2026_01",
  "titleKo": "녹슨 별의 구조 신호",
  "startsAt": "2026-07-06T00:00:00Z",
  "endsAt": "2026-08-31T00:00:00Z",
  "selectionSeed": 2,
  "weeklyXPCap": 2500,
  "codexEntryID": "codex_season_rust_signal",
  "dailyMissionPool": [
    {"id":"daily_dismantle","titleKo":"괴수 40체 해체","cadence":"daily","metric":"dismantle_enemy","target":40,"xp":80},
    {"id":"daily_parts","titleKo":"부품 120개 회수","cadence":"daily","metric":"salvage_part","target":120,"xp":80},
    {"id":"daily_manual","titleKo":"직접 해체 80회","cadence":"daily","metric":"manual_salvage","target":80,"xp":70},
    {"id":"daily_crew","titleKo":"직원 협동 공격 120회","cadence":"daily","metric":"crew_attack","target":120,"xp":70},
    {"id":"daily_stage","titleKo":"스테이지 5회 정리","cadence":"daily","metric":"clear_stage","target":5,"xp":100},
    {"id":"daily_facility","titleKo":"시설 작업 2회 완료","cadence":"daily","metric":"facility_job","target":2,"xp":90}
  ],
  "weeklyMissions": [
    {"id":"weekly_boss","titleKo":"압착 괴수 3체 격파","cadence":"weekly","metric":"defeat_boss","target":3,"xp":300},
    {"id":"weekly_stage","titleKo":"스테이지 35회 정리","cadence":"weekly","metric":"clear_stage","target":35,"xp":300},
    {"id":"weekly_parts","titleKo":"부품 1200개 회수","cadence":"weekly","metric":"salvage_part","target":1200,"xp":300},
    {"id":"weekly_facility","titleKo":"시설 작업 15회 완료","cadence":"weekly","metric":"facility_job","target":15,"xp":300}
  ],
  "rewardTiers": [
    {"level":1,"xpRequired":500,"free":{"kind":"currency","itemID":"credits","amount":100},"premium":{"kind":"cosmetic","itemID":"rust_signal_sticker_01","amount":1}},
    {"level":2,"xpRequired":1000,"free":{"kind":"material","itemID":"parts","amount":20},"premium":{"kind":"cosmetic","itemID":"rust_signal_nameplate_02","amount":1}},
    {"level":3,"xpRequired":1500,"free":{"kind":"currency","itemID":"credits","amount":150},"premium":{"kind":"cosmetic","itemID":"rust_signal_emote_03","amount":1}},
    {"level":4,"xpRequired":2000,"free":{"kind":"material","itemID":"circuit","amount":5},"premium":{"kind":"cosmetic","itemID":"rust_signal_trail_04","amount":1}},
    {"level":5,"xpRequired":2500,"free":{"kind":"material","itemID":"parts","amount":30},"premium":{"kind":"convenience","itemID":"loadout_preset_slot_rust_a","amount":1}},
    {"level":6,"xpRequired":3000,"free":{"kind":"currency","itemID":"credits","amount":200},"premium":{"kind":"cosmetic","itemID":"rust_signal_sticker_06","amount":1}},
    {"level":7,"xpRequired":3500,"free":{"kind":"material","itemID":"parts","amount":35},"premium":{"kind":"cosmetic","itemID":"rust_signal_nameplate_07","amount":1}},
    {"level":8,"xpRequired":4000,"free":{"kind":"material","itemID":"alloy","amount":3},"premium":{"kind":"cosmetic","itemID":"rust_signal_emote_08","amount":1}},
    {"level":9,"xpRequired":4500,"free":{"kind":"currency","itemID":"credits","amount":250},"premium":{"kind":"cosmetic","itemID":"rust_signal_trail_09","amount":1}},
    {"level":10,"xpRequired":5000,"free":{"kind":"story","itemID":"rust_signal_record_01","amount":1},"premium":{"kind":"cosmetic","itemID":"mo_rust_signal_gloves","amount":1}},
    {"level":11,"xpRequired":5500,"free":{"kind":"material","itemID":"parts","amount":40},"premium":{"kind":"cosmetic","itemID":"rust_signal_sticker_11","amount":1}},
    {"level":12,"xpRequired":6000,"free":{"kind":"currency","itemID":"credits","amount":300},"premium":{"kind":"cosmetic","itemID":"rust_signal_nameplate_12","amount":1}},
    {"level":13,"xpRequired":6500,"free":{"kind":"material","itemID":"circuit","amount":8},"premium":{"kind":"cosmetic","itemID":"rust_signal_emote_13","amount":1}},
    {"level":14,"xpRequired":7000,"free":{"kind":"material","itemID":"parts","amount":45},"premium":{"kind":"cosmetic","itemID":"rust_signal_trail_14","amount":1}},
    {"level":15,"xpRequired":7500,"free":{"kind":"currency","itemID":"credits","amount":350},"premium":{"kind":"convenience","itemID":"loadout_preset_slot_rust_b","amount":1}},
    {"level":16,"xpRequired":8000,"free":{"kind":"material","itemID":"alloy","amount":5},"premium":{"kind":"cosmetic","itemID":"rust_signal_sticker_16","amount":1}},
    {"level":17,"xpRequired":8500,"free":{"kind":"material","itemID":"parts","amount":50},"premium":{"kind":"cosmetic","itemID":"rust_signal_nameplate_17","amount":1}},
    {"level":18,"xpRequired":9000,"free":{"kind":"currency","itemID":"credits","amount":400},"premium":{"kind":"cosmetic","itemID":"rust_signal_emote_18","amount":1}},
    {"level":19,"xpRequired":9500,"free":{"kind":"material","itemID":"circuit","amount":10},"premium":{"kind":"cosmetic","itemID":"rust_signal_trail_19","amount":1}},
    {"level":20,"xpRequired":10000,"free":{"kind":"story","itemID":"rust_signal_record_02","amount":1},"premium":{"kind":"cosmetic","itemID":"riv0_rust_signal_shell","amount":1}},
    {"level":21,"xpRequired":10500,"free":{"kind":"currency","itemID":"credits","amount":450},"premium":{"kind":"cosmetic","itemID":"rust_signal_sticker_21","amount":1}},
    {"level":22,"xpRequired":11000,"free":{"kind":"material","itemID":"parts","amount":55},"premium":{"kind":"cosmetic","itemID":"rust_signal_nameplate_22","amount":1}},
    {"level":23,"xpRequired":11500,"free":{"kind":"material","itemID":"alloy","amount":7},"premium":{"kind":"cosmetic","itemID":"rust_signal_emote_23","amount":1}},
    {"level":24,"xpRequired":12000,"free":{"kind":"currency","itemID":"credits","amount":500},"premium":{"kind":"cosmetic","itemID":"rust_signal_trail_24","amount":1}},
    {"level":25,"xpRequired":12500,"free":{"kind":"material","itemID":"parts","amount":60},"premium":{"kind":"convenience","itemID":"appearance_preset_slot_rust_a","amount":1}},
    {"level":26,"xpRequired":13000,"free":{"kind":"material","itemID":"circuit","amount":12},"premium":{"kind":"cosmetic","itemID":"rust_signal_sticker_26","amount":1}},
    {"level":27,"xpRequired":13500,"free":{"kind":"currency","itemID":"credits","amount":550},"premium":{"kind":"cosmetic","itemID":"rust_signal_nameplate_27","amount":1}},
    {"level":28,"xpRequired":14000,"free":{"kind":"material","itemID":"parts","amount":65},"premium":{"kind":"cosmetic","itemID":"rust_signal_emote_28","amount":1}},
    {"level":29,"xpRequired":14500,"free":{"kind":"material","itemID":"alloy","amount":9},"premium":{"kind":"cosmetic","itemID":"rust_signal_trail_29","amount":1}},
    {"level":30,"xpRequired":15000,"free":{"kind":"story","itemID":"rust_signal_record_03","amount":1},"premium":{"kind":"cosmetic","itemID":"bora_rust_signal_uniform","amount":1}},
    {"level":31,"xpRequired":15500,"free":{"kind":"currency","itemID":"credits","amount":600},"premium":{"kind":"cosmetic","itemID":"rust_signal_sticker_31","amount":1}},
    {"level":32,"xpRequired":16000,"free":{"kind":"material","itemID":"parts","amount":70},"premium":{"kind":"cosmetic","itemID":"rust_signal_nameplate_32","amount":1}},
    {"level":33,"xpRequired":16500,"free":{"kind":"material","itemID":"circuit","amount":15},"premium":{"kind":"cosmetic","itemID":"rust_signal_emote_33","amount":1}},
    {"level":34,"xpRequired":17000,"free":{"kind":"currency","itemID":"credits","amount":650},"premium":{"kind":"cosmetic","itemID":"rust_signal_trail_34","amount":1}},
    {"level":35,"xpRequired":17500,"free":{"kind":"material","itemID":"parts","amount":75},"premium":{"kind":"convenience","itemID":"appearance_preset_slot_rust_b","amount":1}},
    {"level":36,"xpRequired":18000,"free":{"kind":"material","itemID":"alloy","amount":12},"premium":{"kind":"cosmetic","itemID":"rust_signal_sticker_36","amount":1}},
    {"level":37,"xpRequired":18500,"free":{"kind":"currency","itemID":"credits","amount":700},"premium":{"kind":"cosmetic","itemID":"rust_signal_nameplate_37","amount":1}},
    {"level":38,"xpRequired":19000,"free":{"kind":"material","itemID":"parts","amount":80},"premium":{"kind":"cosmetic","itemID":"rust_signal_emote_38","amount":1}},
    {"level":39,"xpRequired":19500,"free":{"kind":"material","itemID":"stellar_core","amount":1},"premium":{"kind":"cosmetic","itemID":"rust_signal_trail_39","amount":1}},
    {"level":40,"xpRequired":20000,"free":{"kind":"story","itemID":"rust_signal_record_final","amount":1},"premium":{"kind":"cosmetic","itemID":"shelter_rust_signal_skin","amount":1}}
  ]
}
